{
  "id": "urology-urological-emergencies",
  "order": 3,
  "subjectKey": "urology",
  "subject": "Urology",
  "title": "Urological Emergencies",
  "subtitle": "Acute retention, scrotal and penile emergencies, necrotizing infection and urotrauma",
  "sourceNote": "Built only from the uploaded Urological emergencies7 lecture. The bank preserves the lecture definitions, timing, investigations and management statements without adding external guideline details.",
  "cases": [
    {
      "id": "em-aur",
      "title": "Acute Urinary Retention",
      "topic": "Urinary Retention",
      "priority": "High",
      "marks": 8,
      "subtopics": [
        "acute-retention"
      ],
      "scenario": "A 72-year-old man develops sudden complete inability to pass urine with severe lower abdominal pain and a tense distended bladder. He has a previous history of lower urinary tract symptoms.",
      "ar": "رجل 72 سنة حصل له sudden complete inability to urinate مع severe suprapubic pain وdistended bladder.",
      "questions": [
        "What is the diagnosis?",
        "List the causes mentioned in the lecture.",
        "What is the immediate first-line treatment?",
        "What should be done after stabilization?"
      ],
      "answer": [
        "Diagnosis: acute urinary retention.",
        "Causes mentioned: BPH, urethral stricture, medications and neurological disorders.",
        "Immediate bladder catheterization to decompress the bladder using an indwelling Foley catheter or a suprapubic catheter.",
        "After stabilization, identify and treat the underlying cause to prevent recurrence."
      ],
      "marking": [
        "Diagnosis — 1",
        "Causes — 3",
        "Immediate decompression — 3",
        "Underlying cause — 1"
      ],
      "trap": "Do not delay bladder decompression while investigating the cause.",
      "memory": "Acute retention = sudden inability + painful bladder → immediate catheterization."
    },
    {
      "id": "em-torsion",
      "title": "Adolescent with Sudden Scrotal Pain",
      "topic": "Scrotal Emergency",
      "priority": "High",
      "marks": 12,
      "subtopics": [
        "testicular-torsion"
      ],
      "scenario": "A 16-year-old boy presents with sudden severe unilateral scrotal pain, swelling, nausea and vomiting. The affected testis is high-riding.",
      "ar": "ولد 16 سنة عنده sudden severe scrotal pain مع swelling وvomiting والخصية high-riding.",
      "questions": [
        "What is the most likely diagnosis?",
        "State the underlying mechanism and important risk factor.",
        "How is the diagnosis made?",
        "Outline urgent management and the time window.",
        "What is the role of manual detorsion?"
      ],
      "answer": [
        "Diagnosis: testicular torsion.",
        "Twisting of the spermatic cord cuts off testicular blood supply. A bell-clapper deformity is an important risk factor; it is common in adolescents during rapid growth.",
        "Diagnosis is primarily clinical by physical examination; Doppler ultrasound may confirm reduced blood flow.",
        "Urgent surgical detorsion and orchiopexy should be performed within 6 hours to maximize testicular salvage. After 24 hours the testis can rarely be saved.",
        "Manual detorsion may be attempted but must not delay surgery."
      ],
      "marking": [
        "Diagnosis — 1",
        "Mechanism/risk — 3",
        "Diagnosis — 2",
        "Urgent surgery/timing — 4",
        "Manual detorsion — 2"
      ],
      "trap": "Doppler confirmation must not delay urgent surgical intervention.",
      "memory": "Torsion: sudden pain + high testis → surgery within 6 hours."
    },
    {
      "id": "em-ischemic-priapism",
      "title": "Painful Erection for More Than 4 Hours",
      "topic": "Penile Emergency",
      "priority": "High",
      "marks": 9,
      "subtopics": [
        "priapism"
      ],
      "scenario": "A man presents with a prolonged painful erection lasting 6 hours and unrelated to sexual arousal.",
      "ar": "مريض عنده painful erection مستمر 6 ساعات ومش مرتبط بـsexual arousal.",
      "questions": [
        "Define the condition.",
        "What type is most likely?",
        "Outline the treatment stated in the lecture.",
        "How does the other major type differ in urgency and management?"
      ],
      "answer": [
        "Priapism is a prolonged painful erection lasting more than 4 hours and unrelated to sexual arousal.",
        "The painful emergency pattern is ischemic (low-flow) priapism.",
        "Aspirate blood from the corpora cavernosa, then inject a sympathomimetic agent such as phenylephrine directly into the corpora.",
        "Non-ischemic (high-flow) priapism is usually less urgent; urological consultation, observation and ice packs may be sufficient."
      ],
      "marking": [
        "Definition — 2",
        "Type — 1",
        "Ischemic treatment — 4",
        "Non-ischemic comparison — 2"
      ],
      "trap": "Do not treat ischemic and non-ischemic priapism as equally urgent.",
      "memory": "Ischemic = painful low flow → aspirate then intracavernosal phenylephrine."
    },
    {
      "id": "em-nonischemic-priapism",
      "title": "High-Flow Priapism",
      "topic": "Penile Emergency",
      "priority": "Core",
      "marks": 7,
      "subtopics": [
        "priapism"
      ],
      "scenario": "A patient has a prolonged erection after trauma but is otherwise stable, and the urologist considers a high-flow form.",
      "ar": "مريض بعد trauma عنده prolonged erection ويُشتبه في high-flow priapism.",
      "questions": [
        "Classify priapism into its two main types.",
        "Which type is usually less urgent?",
        "State the management options mentioned for this type.",
        "State the emergency treatment of the low-flow type."
      ],
      "answer": [
        "Types: ischemic (low-flow) and non-ischemic (high-flow).",
        "Non-ischemic high-flow priapism is usually less urgent.",
        "Urological consultation; observation and ice packs may be sufficient.",
        "Low-flow ischemic priapism: aspiration from the corpora cavernosa followed by intracavernosal sympathomimetic injection such as phenylephrine."
      ],
      "marking": [
        "Classification — 2",
        "Urgency — 1",
        "High-flow management — 2",
        "Low-flow treatment — 2"
      ],
      "trap": "“Less urgent” does not mean no urological assessment.",
      "memory": "High flow: consult, observe, ice; low flow: aspirate + phenylephrine."
    },
    {
      "id": "em-penile-fracture",
      "title": "Snap, Detumescence and Eggplant Deformity",
      "topic": "Penile Emergency",
      "priority": "High",
      "marks": 10,
      "subtopics": [
        "penile-fracture"
      ],
      "scenario": "During vigorous intercourse, a man hears an audible crack followed by immediate loss of erection, severe pain, swelling and dark-purple penile bruising.",
      "ar": "أثناء intercourse سمع crack وبعدها immediate detumescence مع pain وeggplant deformity.",
      "questions": [
        "What is the diagnosis and injured structure?",
        "List the characteristic symptoms and signs.",
        "What finding suggests associated urethral injury?",
        "What is the standard treatment?",
        "List complications of delayed treatment."
      ],
      "answer": [
        "Diagnosis: penile fracture — traumatic rupture of the tunica albuginea of the erect penis.",
        "Audible snap/crack, rapid detumescence, marked pain and swelling, and eggplant deformity from dark-purple hematoma.",
        "Blood at the penile tip/urethral bleeding suggests urethral injury.",
        "Immediate surgical exploration and repair of the tunica albuginea tear.",
        "Delayed complications: penile curvature (Peyronie disease), erectile dysfunction and painful intercourse."
      ],
      "marking": [
        "Diagnosis/structure — 2",
        "Features — 3",
        "Urethral sign — 1",
        "Treatment — 2",
        "Delayed complications — 2"
      ],
      "trap": "The classic sequence is crack → immediate detumescence → swelling/eggplant deformity.",
      "memory": "Penile fracture = tunica tear + snap + detumescence → immediate repair."
    },
    {
      "id": "em-paraphimosis",
      "title": "Painful Swollen Glans after Retraction",
      "topic": "Penile Emergency",
      "priority": "High",
      "marks": 8,
      "subtopics": [
        "phimosis-paraphimosis"
      ],
      "scenario": "A retracted foreskin cannot be returned over the glans. The glans is swollen and very painful.",
      "ar": "الـprepuce اتسحب للخلف ومش قادر يرجع مكانه مع swollen painful glans.",
      "questions": [
        "What is the diagnosis?",
        "Differentiate it from phimosis.",
        "Why is it a true emergency?",
        "Outline management if manual repositioning fails."
      ],
      "answer": [
        "Diagnosis: paraphimosis.",
        "Phimosis: inability to retract the prepuce behind the glans. Paraphimosis: the prepuce is retracted and cannot return to its original position.",
        "Delay may cause gangrene of the glans.",
        "Attempt manual preputial repositioning; if this fails, urgent dorsal slit incision may relieve the constricting ring."
      ],
      "marking": [
        "Diagnosis — 1",
        "Difference — 3",
        "Emergency reason — 2",
        "Management — 2"
      ],
      "trap": "Do not confuse inability to retract (phimosis) with inability to return a retracted foreskin (paraphimosis).",
      "memory": "Paraphimosis = trapped retracted foreskin → reduce; dorsal slit if failed."
    },
    {
      "id": "em-fournier",
      "title": "Rapidly Progressive Perineal Sepsis",
      "topic": "Infection",
      "priority": "High",
      "marks": 11,
      "subtopics": [
        "fournier"
      ],